identifier,language,title,genre,abstract,subjects
doi:10.1007/978-3-031-16203-9_8,en,The Comprehensive Model of Using In-Depth Consolidated Multimodal Learning to Study Trading Strategies in the Securities Market,OriginalPaper,"The paper describes the relevance of machine learning methods, namely training with reinforcement, to the problems of predicting financial time series. An overview of existing applications based on machine learning in the issues of financial market forecasting is presented. The reasons for the popularity of my research topic are highlighted both from the scientific (increasing the number of publications on issues relevant to the research topic over the past five years) and from the practical side. The analysis of scientific works, the subject and purpose of which are related to the issues and objectives of my research and their features are presented. The main problems associated with the problem of predicting stochastic time series are identified. According to the analysis, the purpose of work is defined, and also the list of tasks for the achievement of the set goal is made. The article is devoted to studying the use of the ensemble of neuro-learning networks with the strengthening of the securities trading market. The practical significance of the work is to use the model of efficient distribution of investments in the market. This paper will explore a set of models that use in-depth consolidated learning to explore trading strategies to maximize return on investment. The potential of using acting-critical models as an ensemble has been studied. Models such as Proximal Policy Optimizer (PPO), Advantage Actor-Critic (A2C) and Deep Determinist Police Gradient (DDPG) were used to teach trading strategy. To adapt the model to different situations, analyzes are analyzed according to three algorithms: the Dow Jones average and a portfolio that minimizes fluctuations in the Charpy ratio by balancing risk and return. The article compares ensembles by the method of fixing deep neural networks. To optimize the balance of risk and profit, the indicators of the ensemble model are analyzed. The ensemble and three-component models that apply well to market collapse conditions are considered. The models have learned to use the turbulence index for early stock sales to minimize losses during a stock collapse. The turbulence index threshold is demonstrated using ensemble models to regulate risk avoidance.","['Engineering', 'Computational Intelligence', 'Artificial Intelligence']"
doi:10.1007/978-3-031-08246-7_7,en,Implementation of Reinforcement-Learning Algorithms in Autonomous Robot Navigation,OriginalPaper,"The problem of autonomous robot navigation in indoor environments must overcome various difficulties such as the dimensionality of the data, the computational cost, and the possible presence of mobile objects. This chapter addresses the implementation of an algorithm for autonomous navigation of robots in indoor environments based on machine learning. It characterizes some strategies that the literature reports and specifies a Deep Q-Network reinforcement-learning algorithm to implement on the Turtlebot robotic platform of the Gazebo simulator. Besides, a series of experiments changing the parameters of algorithm to validate the strategy shows how the robotic platform, through the exploration of the environment and the subsequent exploitation of the information, creates effective route planning.","['Engineering', 'Computational Intelligence', 'Artificial Intelligence']"
doi:10.1007/978-981-19-4960-9_31,en,Reinforcement Learning for Autonomous Driving Scenarios in Indian Roads,OriginalPaper,"The decision-making process for autonomous vehicles comes with numerous challenges that are not easily solved. With the ever-changing traffic situation of the world and the increasing need for autonomous driving technology, there are constant innovations to deal with the increasing number of problems in the complex environments that autonomous driving agents find themselves in. Developing countries like India face even more numerous challenges with existing autonomous driving solutions not being directly transferable. However, with the maturation and advancement of deep learning technology over the years, more and more novel methods in the field of deep reinforcement learning are being proposed to tackle both new challenges and existing challenges. In this study, we explore the contemporary reinforcement learning techniques for autonomous driving tasks and analyze their applicability for the unstructured road environment and also look at some of the less-common scenarios that occur frequently in the Indian context.","['Engineering', 'Computational Intelligence', 'Artificial Intelligence', 'Professional Computing']"
doi:10.1007/978-3-031-18461-1_11,en,"A Survey of Reinforcement Learning Toolkits for Gaming: Applications, Challenges and Trends",OriginalPaper,"The gaming industry has become one of the most exciting and creative industries. The annual revenue has crossed $200 billion in recent years and has created a lot of jobs globally. Many games are using Artificial Intelligence (AI) and techniques like Machine Learning (ML), Reinforcement Learning (RL) gained popularity among researchers and game development community to enable smart games involving AI-based agents at a faster rate. Although, many toolkits are available for use, a framework to evaluate, compare and advise on these toolkits is still missing. In this paper, we present a comprehensive overview of ML/RL toolkits for games with an emphasis on their applications, challenges, and trends. We propose a qualitative evaluation methodology, discuss the obtained analysis results, and conclude with future work and perspectives.","['Engineering', 'Computational Intelligence', 'Control, Robotics, Mechatronics', 'Artificial Intelligence']"
doi:10.1007/978-981-19-7648-3_12,en,Priority-Aware Computational Resource Allocation,OriginalPaper,"Vehicular fog computing (VFC) has been expected as a promising scheme that can increase the computational capability of vehicles without relying on servers. Comparing with accessing the remote cloud, VFC is suitable for delay-sensitive tasks because of its low-latency vehicle-to-vehicle (V2V) transmission. However, due to the dynamic vehicular environment, how to motivate vehicles to share their idle computing resource while simultaneously evaluating the service availability of vehicles in terms of vehicle mobility and vehicular computational capability in heterogeneous vehicular networks is a main challenge. Meanwhile, tasks with different priorities of a vehicle should be processed with different efficiencies. In this work, we propose a task offloading scheme in the context of VFC, where vehicles are incentivized to share their idle computing resource by dynamic pricing, which comprehensively considers the mobility of vehicles, the task priority, and the service availability of vehicles. Given that the policy of task offloading depends on the state of the dynamic vehicular environment, we formulate the task offloading problem as a Markov decision process (MDP) aiming at maximizing the mean latency-aware utility of tasks in a period. To solve this problem, we develop a soft actor-critic (SAC) based deep reinforcement learning (DRL) algorithm for the sake of maximizing both the expected reward and the entropy of policy. Finally, extensive simulation results validate the effectiveness and superiority of our proposed scheme benchmarked with traditional algorithms.","['Computer Science', 'Computer Systems Organization and Communication Networks', 'Communications Engineering, Networks', 'Wireless and Mobile Communication']"
doi:10.1007/978-981-19-4815-2_6,en,A-DDPG: Attention Mechanism-Based Deep Reinforcement Learning for NFV,OriginalPaper,"Chapters 3–5 transform the VNF placement and traffic routing proble into some well-known NP-hard problems, and then a heuristic or approximation method is proposed to solve it, at the expense of ignoring the network state dynamics. To bridge that gap, in this chapter, we formulate the VNF placement and traffic routing problem as a Markov Decision Process model to capture the dynamic network state transitions. In order to jointly minimize the delay and cost of NFV providers and maximize the revenue, we devise a customized Deep Reinforcement Learning (DRL) algorithm, called A-DDPG, for VNF placement and traffic routing in a real-time network. A-DDPG uses the attention mechanism to ascertain smooth network behavior within the general framework of network utility maximization (NUM). The simulation results show that A-DDPG outperforms the state-of-the-art in terms of network utility, delay, and cost.","['Engineering', 'Communications Engineering, Networks', 'Graph Theory', 'Operations Research, Management Science', 'Theory of Computation', 'Algorithm Analysis and Problem Complexity']"
doi:10.1007/978-3-031-11814-2_5,en,Multi-Echelon Inventory Optimization Using Deep Reinforcement Learning,OriginalPaper,"In this chapter, we provide an overview of inventory management within the pharmaceutical industry and how to model and optimize it. Inventory management is a highly relevant topic, as it causes high costs such as holding, shortage, and reordering costs. Especially the event of a stock-out can cause damage that goes beyond monetary damage in the form of lost sales. To minimize those costs is the task of an optimized reorder policy. A reorder policy is optimal when it minimizes the accumulated cost in every situation. However, finding an optimal policy is not trivial. First, the problem is highly stochastic as we need to consider variable demands and lead times. Second, the supply chain consists of several warehouses incl. the factory, global distribution warehouses, and local affiliate warehouses, whereby the reorder policy of each warehouse has an impact on the optimal reorder policy of related warehouses. In this context, we discuss the concept of multi-echelon inventory optimization and a methodology that is capable of capturing both, the stochastic behavior of the environment and how it is impacted by the reorder policy: Markov decision processes (MDPs). On this basis, we introduce the concept, its related benefits and weaknesses of a methodology named Reinforcement Learning (RL). RL is capable of finding (near-) optimal (reorder) policies for MDPs. Furthermore, some simulation-based results and current research directions are presented.","['Economics', 'Health Economics', 'Pharmaceutical Sciences/Technology', 'Economics, general', 'Biomedicine, general', 'Biotechnology', 'Economic Theory/Quantitative Economics/Mathematical Methods']"
doi:10.1007/978-3-031-16075-2_29,en,Towards End-to-End Chase in Urban Autonomous Driving Using Reinforcement Learning,OriginalPaper,"This paper addresses the challenging task of developing an autonomous chase protocol. First, training of an autonomous vehicle capable of driving autonomously from point A to B was developed to proceed with a chase protocol as a second step. A dedicated driving setup, based on a discrete action space and a single RGB camera, was developed through a series of experiments. A dedicated curriculum learning agenda allowed to train the model capable of performing all fundamental road maneuvers. Several reward functions were proposed, which enabled effective training of the agent. In the subsequent experiments, we selected the reward function and model that produced the most significant outcome, guaranteeing that the chasing car was within 25 m of a runaway car for 63% of the episode duration. To the best of our knowledge, this work is the first one that addressed the task of the chase in urban driving using the Reinforcement Learning approach.","['Engineering', 'Computational Intelligence', 'Control, Robotics, Mechatronics', 'Artificial Intelligence']"
doi:10.1007/978-981-19-2600-6_17,en,Towards Efficient Edge Computing Through Adoption of Reinforcement Learning Strategies: A Review,OriginalPaper,"This paper contributes towards the mapping of the variants of Reinforcement Learning (RL) techniques to solve the key challenges of Edge Computing (EC) through broadly addressing task handling and Quality of Service (QoS) parameters. EC has bolstered ever since the advent of Industry 4.0 with computationally reliable heterogeneous mobile secured dynamic edge devices powered by an array of multifarious sensors designed on multi-edge hierarchical architectures found a strong footing on the backbone of ably equipped communication protocols to manifest their growth powered by the advent of 5G technology. However, with millions of such edge devices finding its way in a plethora of EC applications, with each having its own set of domain specific challenges, devising a suitable agent so as to sense the environment and learn from it has driven RL find its way as one of the significant tools to make the EC framework intelligent. Here we lay a good understanding of how RL has achieved noteworthy success to solve some of the pressing EC challenges, given that EC finds its use in settings of autonomous driving, content delivery, smart grid, healthcare applications and so on.","['Engineering', 'Data Engineering', 'Statistics, general', 'Machine Learning', 'Artificial Intelligence', 'Data Storage Representation', 'Data Structures and Information Theory']"
doi:10.1007/978-3-031-11748-0_14,en,A Study on Efficient Reinforcement Learning Through Knowledge Transfer,OriginalPaper,"Although Reinforcement Learning (RL) algorithms have made impressive progress in learning complex tasks over the past years, there are still prevailing short-comings and challenges. Specifically, the sample-inefficiency and limited adaptation across tasks often make classic RL techniques impractical for real-world applications despite the gained representational power when combining deep neural networks with RL, known as Deep Reinforcement Learning (DRL). Recently, a number of approaches to address those issues have emerged. Many of those solutions are based on smart DRL architectures that enhance single task algorithms with the capability to share knowledge between agents and across tasks by introducing Transfer Learning (TL) capabilities. This survey addresses strategies of knowledge transfer from simple parameter sharing to privacy preserving federated learning and aims at providing a general overview of the field of TL in the DRL domain, establishes a classification framework, and briefly describes representative works in the area.","['Engineering', 'Computational Intelligence', 'Artificial Intelligence', 'Machine Learning']"
doi:10.1007/978-3-031-13786-0_1,en,"A Comprehensive Study on 5G: RAN Architecture, Enabling Technologies, Challenges, and Deployment",OriginalPaper,"The fifth-generation (5G) technology promises to provide agile, scalable, and programmable network services in order to respond to the myriad of applications and connected devices of vertical industries. It aims to boost the network capacity, throughput, energy, and spectral efficiencies while reducing latency for sub-milliseconds. In order to fulfill the diverse requirements of industrial Internet of Things (IIoT) applications, drastic changes have been proposed by several telecommunication bodies for the radio access network (RAN) and core. In this chapter, we aim to study comprehensively the 5G architectural frameworks proposed by telecommunication bodies and standards for public and private 5G networks. Furthermore, this chapter provides an in-depth study on the key 5G enabling technologies such as software-defined network (SDN), network functions virtualization (NFV), network slicing, artificial intelligence/machine learning (AI/ML), and multi-access edge computing (MEC). Moreover, 5G simulators and projects are explored and compared considering features, advantages, and limitations.","['Engineering', 'Communications Engineering, Networks', 'Cyber-physical systems, IoT', 'Computer Communication Networks']"
doi:10.1007/978-3-031-16035-6_4,en,One-Shot Federated Learning-based Model-Free Reinforcement Learning,OriginalPaper,"The Federated Learning (FL) paradigm is emerging as a way to train machine learning (ML) models in distributed systems. A large population of interconnected devices (i.e. Internet of Things (IoT)) acting as local learners optimize the model parameters collectively (e.g., neural networks’ weights), rather than sharing and disclosing the training data set with the server. FL approaches assume each participant has enough training data for the tasks of interest. Realistically, data collected by IoT devices may be insufficient and often unlabeled. In particular, each IoT device may only contain one or a few samples of every relevant data category, and may not have the time or interest to label them. In realistic applications, this severely limits FL’s practicality and usability. In this paper, we propose a One-Shot Federated Learning (OSFL) framework considering a FL scenario wherein the local training is carried out on IoT devices and the global aggregation is done at the level of an edge server. Moreover, we combine model-free reinforcement learning with OSFL to design a more intelligent IoT device to infer whether to label a sample automatically or request the true label for the one-shot learning set-up. We validate our system on the SODA10M dataset. Experiments show that our solution achieves better performance than DQN and RS benchmark approaches.","['Engineering', 'Computational Intelligence', 'Data Engineering']"
doi:10.1007/978-3-031-16078-3_6,en,Training Heterogeneous Features in Sequence to Sequence Tasks: Latent Enhanced Multi-filter Seq2Seq Model,OriginalPaper,"In language processing, training data with extremely large variance may lead to difficulty of language model’s convergence. It is difficult for the network parameters to adapt sentences with largely varied semantics or grammatical structures. To resolve this problem, we introduce a model that concentrates the each of the heterogeneous features in the input sentences. Build upon the encoder-decoder architecture, we design a latent-enhanced multi-filter seq2seq model (LEMS) that analyzes the input representations by introducing a latent space transformation and clustering. The representations are extracted from the final hidden state of the encoder and lie in the latent space. A latent space transformation is applied for enhancing the quality of the representations. Thus the clustering algorithm can easily separate samples based on the features of these representations. Multiple filters are trained by the features from their corresponding clusters, the heterogeneity of the training data can be resolved accordingly. We conduct two sets of comparative experiments on semantic parsing and machine translation, using the Geo-query dataset and Multi30k English-French to demonstrate the enhancement our model has made, respectively.","['Engineering', 'Computational Intelligence', 'Control, Robotics, Mechatronics', 'Artificial Intelligence']"
doi:10.1007/978-981-19-3951-8_46,en,"A PSO-Optimized Fixed and a PSO-Optimized Neural Network-Adaptive Traffic Signal Controllers for Traffic Improvement in Santo Domingo, Dominican Republic",OriginalPaper,"Satisfying the mobility demand is one of the biggest concerns arising with the increase of urban population. With many people in the road network, traffic congestions are present in most of the cities in the world. The Distrito Nacional in Santo Domingo, capital city of Dominican Republic, is a notorious example of this phenomenon. Unfortunately, all the efforts to improve traffic experience there have had little success. With this work, two models have been developed using Particle Swarm Optimization (PSO): a PSO-Optimized Fixed Traffic Signal Control (PSO-FTSC) and a PSO-Optimized Neural Network-Adaptive Traffic Signal Control (PSO-NN-ATSC) that uses 4 neural networks to predict phase times. The intersection of 27 de Febrero Avenue corner with Winston Churchill Avenue was simulated using Simulation of Urban Mobility (SUMO), minimizing the time loss per vehicle during optimization. These models, PSO-FTSC and PSO-NN-ATSC, present reductions of 17% and 24% of mean time loss, respectively. These promising results may lead to a decrease of fuel consumption, reducing the consequent air pollution, as well as to an improvement of businesses and people’s productivity and mental health.","['Engineering', 'Computational Intelligence', 'Signal, Image and Speech Processing', 'Communications Engineering, Networks', 'Artificial Intelligence']"
doi:10.1007/978-3-031-15160-6_14,en,Intelligent Load Scheduling in Cognitive Buildings: A Use Case,OriginalPaper,"In the last few years, many appliances are spreading into our houses and are daily used. Such equipment significantly improves the quality of life of people, but their use, when not well regulated, can bring a needless increment in the electricity bill. Such an increment could be mitigated by using intelligent scheduling policies that guide the users toward correct exploitation of electric devices so optimizing their use while, at the same time, saving energy, money, and time. This chapter proposes a case study in which a cognitive scheduling approach is used. Such a case study, implemented in the context of the COGITO project, is devoted to automatically scheduling electric loads in houses according to user preferences, self-produced energy, and variable energy costs.","['Engineering', 'Cyber-physical systems, IoT', 'Communications Engineering, Networks', 'Computer Applications']"
doi:10.1186/s13677-022-00372-9,en,Task offloading in hybrid-decision-based multi-cloud computing network: a cooperative multi-agent deep reinforcement learning,"['OriginalPaper', 'Research']","Multi-cloud computing is becoming a promising paradigm to provide abundant computation resources for Internet-of-Things (IoT) devices. For a multi-device multi-cloud network, the real-time computing requirements, frequently varied wireless channel gains and changeable network scale, make the system more dynamic. It is critical to satisfy the dynamic nature of network with different constraints of IoT devices in multi-cloud environment. In this paper, we establish a continuous-discrete hybrid decision offloading model, each device should learn to make coordinated actions, including cloud server selection, offloading ratio and local computation capacity. Therefore, both continuous-discrete hybrid decision and coordination among IoT devices are challenging. To this end, we first develop a probabilistic method to relax the discrete action (e.g. cloud server selection) to a continuous set. Then, by leveraging a centralized training and distributed execution strategy, we design a cooperative multi-agent deep reinforcement learning (CMADRL) based framework to minimize the total system cost in terms of the energy consumption of IoT device and the renting charge of cloud servers. Each IoT device acts as an agent, which not only learns efficient decentralized policies, but also relieves IoT devices’ computing pressure. Experimental results demonstrate that the proposed CMADRL could efficiently learn dynamic offloading polices at each IoT device, and significantly outperform the four state-of-the-art DRL based agents and two heuristic algorithms with lower system cost.","['Computer Science', 'Computer Communication Networks', 'Special Purpose and Application-Based Systems', 'Information Systems Applications (incl.Internet)', 'Computer Systems Organization and Communication Networks', 'Computer System Implementation', 'Software Engineering/Programming and Operating Systems']"
doi:10.1007/s12652-022-04467-8,en,Development of reinforced learning based non-linear controller for unmanned aerial vehicle,"['OriginalPaper', 'Original Research']","Design complexities of trending UAVs and the operational harsh environments necessitates Control Law formulation utilizing intelligent techniques that are both robust, model-free and adaptable. In this research, an intelligent control architecture for an experimental Unmanned Aerial Vehicle (UAV) having an unconventional inverted V-tail design, is presented. Due to unique design of the vehicle strong roll and yaw coupling exists, making the control of vehicle challenging. To handle UAV’s inherent control complexities, while keeping them computationally acceptable, a variant of distinct Deep Reinforcement learning (DRL) algorithm, namely Reformed Deep Deterministic Policy Gradient (R-DDPG) is proposed. Conventional DDPG algorithm after being modified in its learning architecture becomes capable of intelligently handling the continuous state and control space domains besides controlling the platform in its entire flight regime. The paper illustrates the application of modified DDPG algorithm (namely R-DDPG) towards the design, while the performance of the resulting controller is assessed in simulation using dynamic model of the vehicle. Nonlinear simulations were then performed to analyze UAV performance under different environmental and launch conditions. The effectiveness of the proposed strategy is further demonstrated by comparing the results with the linear controller for the same UAV whose feedback loop gains are optimized by employing technique of optimal control theory achieved through application of Linear quadratic regulator (LQR) based control strategy. The efficacy of the results and performance characteristics, demonstrated the ability of the presented algorithm to dynamically adapt to the changing environment, thereby making it suitable for UAV applications.","['Engineering', 'Computational Intelligence', 'Artificial Intelligence', 'Robotics and Automation', 'User Interfaces and Human Computer Interaction']"
