identifier,language,title,genre,abstract,subjects
doi:10.1007/s10489-022-03470-y,en,Modeling multi-scale sub-group context for group activity recognition,OriginalPaper,"Group activity recognition is a challenging task for complex motion and relation between actors. To utilize similar action of actors, this paper proposes a novel multi-scale Sub-group Context Block (SCB) for group Activity Recognition. Node embedding matrix and adjacent matrix are constructed and fed into SCB. In SCB, we use an assignment matrix to learn the mapping from actors to sub-groups, so the representation and interaction of sub-group can be learned automatically. Then Graph Convolution is used for further feature representation refine. In order to emphasize effect of different sub-groups, a reinforcement learning based module Sub-group Attention Block (SAB) is designed, which models it as a Markov decision process and gives each sub-group an importance value for further procedure. Multi-scale context for group activity in different levels is adopted by fusing features obtained with various clustering numbers. Finally, temporal information is integrated by multiple frames merging. Extensive experiments are performed on two standard group activity recognition datasets: the Volleyball and the Collective Activity. Our proposed method gets outstanding performance. The results also validate that SCB and SAB are effective for group activity recognition.","['Computer Science', 'Artificial Intelligence', 'Mechanical Engineering', 'Manufacturing, Machines, Tools, Processes']"
doi:10.1007/s10489-022-03456-w,en,Deep reinforcement learning for the dynamic and uncertain vehicle routing problem,OriginalPaper,"Accurate and real-time tracking for real-world urban logistics has become a popular research topic in the field of intelligent transportation. While the routing of urban logistic service is usually accomplished via complex mathematical and analytical methods. However, the nature and scope of real-world urban logistics are highly dynamic, and the existing optimization technique cannot precisely formulate the dynamic characteristics of the route. To ensure customers’ demands are met, planners need to respond to these changes quickly (sometimes instantaneously). This paper proposes the formulation of a novel deep reinforcement learning framework to solve a dynamic and uncertain vehicle routing problem (DU-VRP), whose objective is to meet the uncertain servicing needs of customers in a dynamic environment. Considering uncertain information about the demands of customers in this problem, the partial observation Markov decision process is designed to frequently observe the changes in customers’ demands in a real-time decision support system that consists of a deep neural network with a dynamic attention mechanism. Besides, a cutting-edge reinforcement learning algorithm is presented to control the value function of the DU-VRP for better training the routing process’s dynamics and uncertainty. Computational experiments are conducted considering different data sources to obtain satisfactory solutions of the DU-VRP.","['Computer Science', 'Artificial Intelligence', 'Mechanical Engineering', 'Manufacturing, Machines, Tools, Processes']"
doi:10.1007/s10462-021-10061-9,en,Deep reinforcement learning in computer vision: a comprehensive survey,OriginalPaper,"Deep reinforcement learning augments the reinforcement learning framework and utilizes the powerful representation of deep neural networks. Recent works have demonstrated the remarkable successes of deep reinforcement learning in various domains including finance, medicine, healthcare, video games, robotics, and computer vision. In this work, we provide a detailed review of recent and state-of-the-art research advances of deep reinforcement learning in computer vision. We start with comprehending the theories of deep learning, reinforcement learning, and deep reinforcement learning. We then propose a categorization of deep reinforcement learning methodologies and discuss their advantages and limitations . In particular, we divide deep reinforcement learning into seven main categories according to their applications in computer vision, i.e. (i) landmark localization (ii) object detection; (iii) object tracking; (iv) registration on both 2D image and 3D image volumetric data (v) image segmentation; (vi) videos analysis; and (vii) other applications. Each of these categories is further analyzed with reinforcement learning techniques, network design, and performance. Moreover, we provide a comprehensive analysis of the existing publicly available datasets and examine source code availability. Finally, we present some open issues and discuss future research directions on deep reinforcement learning in computer vision.","['Computer Science', 'Artificial Intelligence', 'Computer Science, general']"
doi:10.1007/s10462-021-10085-1,en,Model-free reinforcement learning from expert demonstrations: a survey,OriginalPaper,"Reinforcement learning from expert demonstrations (RLED) is the intersection of imitation learning with reinforcement learning that seeks to take advantage of these two learning approaches. RLED uses demonstration trajectories to improve sample efficiency in high-dimensional spaces. RLED is a new promising approach to behavioral learning through demonstrations from an expert teacher. RLED considers two possible knowledge sources to guide the reinforcement learning process: prior knowledge and online knowledge. This survey focuses on novel methods for model-free reinforcement learning guided through demonstrations, commonly but not necessarily provided by humans. The methods are analyzed and classified according to the impact of the demonstrations. Challenges, applications, and promising approaches to improve the discussed methods are also discussed.","['Computer Science', 'Artificial Intelligence', 'Computer Science, general']"
doi:10.1007/s40747-021-00577-6,en,Missile guidance with assisted deep reinforcement learning for head-on interception of maneuvering target,"['OriginalPaper', 'Original Article']","In missile guidance, pursuit performance is seriously degraded due to the uncertainty and randomness in target maneuverability, detection delay, and environmental noise. In many methods, accurately estimating the acceleration of the target or the time-to-go is needed to intercept the maneuvering target, which is hard in an environment with uncertainty. In this paper, we propose an assisted deep reinforcement learning (ARL) algorithm to optimize the neural network-based missile guidance controller for head-on interception. Based on the relative velocity, distance, and angle, ARL can control the missile to intercept the maneuvering target and achieve large terminal intercept angle. To reduce the influence of environmental uncertainty, ARL predicts the target’s acceleration as an auxiliary supervised task. The supervised learning task improves the ability of the agent to extract information from observations. To exploit the agent’s good trajectories, ARL presents the Gaussian self-imitation learning to make the mean of action distribution approach the agent’s good actions. Compared with vanilla self-imitation learning, Gaussian self-imitation learning improves the exploration in continuous control. Simulation results validate that ARL outperforms traditional methods and proximal policy optimization algorithm with higher hit rate and larger terminal intercept angle in the simulation environment with noise, delay, and maneuverable target.","['Engineering', 'Computational Intelligence', 'Complexity', 'Data Structures and Information Theory']"
doi:10.1007/s10207-021-00554-7,en,The Agent Web Model: modeling web hacking for reinforcement learning,"['OriginalPaper', 'Regular contribution']","Website hacking is a frequent attack type used by malicious actors to obtain confidential information, modify the integrity of web pages or make websites unavailable. The tools used by attackers are becoming more and more automated and sophisticated, and malicious machine learning agents seem to be the next development in this line. In order to provide ethical hackers with similar tools, and to understand the impact and the limitations of artificial agents, we present in this paper a model that formalizes web hacking tasks for reinforcement learning agents. Our model, named Agent Web Model , considers web hacking as a capture-the-flag style challenge, and it defines reinforcement learning problems at seven different levels of abstraction. We discuss the complexity of these problems in terms of actions and states an agent has to deal with, and we show that such a model allows to represent most of the relevant web vulnerabilities. Aware that the driver of advances in reinforcement learning is the availability of standardized challenges, we provide an implementation for the first three abstraction layers, in the hope that the community would consider these challenges in order to develop intelligent web hacking agents.","['Computer Science', 'Cryptology', 'Computer Communication Networks', 'Operating Systems', 'Coding and Information Theory', 'Management of Computing and Information Systems', 'Communications Engineering, Networks']"
doi:10.1007/s10922-022-09654-8,en,On the Robustness of Controlled Deep Reinforcement Learning for Slice Placement,OriginalPaper,"The evaluation of the impact of using Machine Learning in the management of softwarized networks is considered in multiple research works. In this paper, we propose to evaluate the robustness of online learning for optimal network slice placement. A major assumption in this study is to consider that slice request arrivals are non-stationary. We precisely simulate unpredictable network load variations and compare two Deep Reinforcement Learning (DRL) algorithms: a pure DRL-based algorithm and a heuristically controlled DRL as a hybrid DRL-heuristic algorithm, in order to assess the impact of these unpredictable changes of traffic load on the algorithms performance. We conduct extensive simulations of a large-scale operator infrastructure. The evaluation results show that the proposed hybrid DRL-heuristic approach is more robust and reliable than pure DRL in real network scenarios.","['Computer Science', 'Computer Communication Networks', 'Computer Systems Organization and Communication Networks', 'Communications Engineering, Networks', 'Information Systems and Communication Service', 'Operations Research/Decision Theory']"
doi:10.1007/s43684-022-00023-5,en,Multi-agent reinforcement learning for cooperative lane changing of connected and autonomous vehicles in mixed traffic,"['OriginalPaper', 'Original Article']","Autonomous driving has attracted significant research interests in the past two decades as it offers many potential benefits, including releasing drivers from exhausting driving and mitigating traffic congestion, among others. Despite promising progress, lane-changing remains a great challenge for autonomous vehicles (AV), especially in mixed and dynamic traffic scenarios. Recently, reinforcement learning (RL) has been widely explored for lane-changing decision makings in AVs with encouraging results demonstrated. However, the majority of those studies are focused on a single-vehicle setting, and lane-changing in the context of multiple AVs coexisting with human-driven vehicles (HDVs) have received scarce attention. In this paper, we formulate the lane-changing decision-making of multiple AVs in a mixed-traffic highway environment as a multi-agent reinforcement learning (MARL) problem, where each AV makes lane-changing decisions based on the motions of both neighboring AVs and HDVs. Specifically, a multi-agent advantage actor-critic (MA2C) method is proposed with a novel local reward design and a parameter sharing scheme. In particular, a multi-objective reward function is designed to incorporate fuel efficiency, driving comfort, and the safety of autonomous driving. A comprehensive experimental study is made that our proposed MARL framework consistently outperforms several state-of-the-art benchmarks in terms of efficiency, safety, and driver comfort.","['Engineering', 'Robotics and Automation', 'Artificial Intelligence', 'Control and Systems Theory', 'Machine Learning']"
doi:10.1007/s10479-022-04612-8,en,A deep reinforcement learning assisted simulated annealing algorithm for a maintenance planning problem,"['OriginalPaper', 'Original Research']","Maintenance planning aims to improve the reliability of assets, prevent the occurrence of asset failures, and reduce maintenance costs associated with downtime of assets and maintenance resources (such as spare parts and workforce). Thus, effective maintenance planning is instrumental in ensuring high asset availability with the minimum cost. Nevertheless, to find such optimal planning is a nontrivial task due to the (i) complex and usually nonlinear inter-relationship between different planning decisions (e.g., inventory level and workforce capacity), and (ii) stochastic nature of the system (e.g., random failures of parts installed in assets). To alleviate these challenges, we study a joint maintenance planning problem by considering several decisions simultaneously, including workforce planning, workforce training, and spare parts inventory management. We develop a hybrid solution algorithm ( $$\mathcal {DRLSA}$$ DRLSA ) that is a combination of Double Deep Q-Network based Deep Reinforcement Learning (DRL) and Simulated Annealing (SA) algorithms. In each episode of the proposed algorithm, the best solution found by DRL is delivered to SA to be used as an initial solution, and the best solution of SA is delivered to DRL to be used as the initial state. Different from the traditional SA algorithms where neighborhood structures are selected only randomly, the DRL part of $$\mathcal {DRLSA}$$ DRLSA learns to choose the best neighborhood structure to use based on experience gained from previous episodes. We compare the performance of the proposed solution algorithm with several well-known meta-heuristic algorithms, including Simulated Annealing, Genetic Algorithm (GA), and Variable Neighborhood Search (VNS). Further, we also develop a Machine Learning (ML) algorithm (i.e., K-Median) as another benchmark in which different properties of spare parts (e.g., failure rates, holding costs, and repair rates) are used as clustering features for the ML algorithm. Our study reveals that the $$\mathcal {DRLSA}$$ DRLSA finds the optimal solutions for relatively small-size instances, and it has the potential to outperform traditional meta-heuristic and ML algorithms.","['Business and Management', 'Operations Research/Decision Theory', 'Combinatorics', 'Theory of Computation']"
doi:10.1038/s41598-022-07264-7,en,A target-driven visual navigation method based on intrinsic motivation exploration and space topological cognition,"['OriginalPaper', 'Article']","Target-driven visual navigation is essential for many applications in robotics, and it has gained increasing interest in recent years. In this work, inspired by animal cognitive mechanisms, we propose a novel navigation architecture that simultaneously learns exploration policy and encodes environmental structure. First, to learn exploration policy directly from raw visual input, we use deep reinforcement learning as the basic framework and allow agents to create rewards for themselves as learning signals. In our approach, the reward for the current observation is driven by curiosity and calculated by a count-based approach and temporal distance. While agents learn exploration policy, we use temporal distance to find waypoints in observation sequences and incrementally describe the structure of the environment in a way that integrates episodic memory. Finally, space topological cognition is integrated into the model as a path planning module and combined with a locomotion network to obtain a more generalized approach to navigation. We test our approach in the DMlab, a visually rich 3D environment, and validate its exploration efficiency and navigation performance through extensive experiments. The experimental results show that our approach can explore and encode the environment more efficiently and has better capability in dealing with stochastic objects. In navigation tasks, agents can use space topological cognition to effectively reach the target and guide detour behaviour when a path is unavailable, exhibiting good environmental adaptability.","['Science, Humanities and Social Sciences, multidisciplinary', 'Science, Humanities and Social Sciences, multidisciplinary', 'Science, multidisciplinary']"
doi:10.1007/s00521-021-05737-w,en,Cross-domain recommendation based on latent factor alignment,"['OriginalPaper', 'Special issue on Multi-modal Information Learning and Analytics on Big Data']","Recently, various cross-domain recommendation (CDR) models are proposed to overcome the sparsity problem, which leverage relatively abundant rating data from the auxiliary domain to improve recommendation performance of target domain. Though matrix factorization-based collaborative filtering algorithms gain dominance in single-domain recommendation systems, they cannot be used directly in cross-domain cases as the obtained latent factors of the target and auxiliary domains may not be aligned, which will lead to inaccurate knowledge transfer from the auxiliary domain to the target one. A CDR model named CDCFLFA is presented in this paper to solve this problem. In CDCFLFA, firstly latent factors between the two domains are aligned based on pattern matching. Then, user preferences of the auxiliary domain are transferred to update the original user latent vectors of target domain. Finally, a linear least square problem is solved to compute the item latent vectors of target domain and thus unknown ratings are obtained according to the updated user and item latent vectors. CDCFLFA does not require the same user or item sets between the two domains. Extensive experiments are conducted, and the results show that CDCFLFA achieves smaller MAE and RMSE values and larger precision and recall than the previous single- and cross-domain recommendation methods. Hence, CDCFLFA can be regarded as an effective cross-domain extension of single-domain matrix factorization algorithm.","['Computer Science', 'Artificial Intelligence', 'Data Mining and Knowledge Discovery', 'Probability and Statistics in Computer Science', 'Computational Science and Engineering', 'Image Processing and Computer Vision', 'Computational Biology/Bioinformatics']"
doi:10.1007/s12083-021-01273-5,en,Energy-effective artificial internet-of-things application deployment in edge-cloud systems,OriginalPaper,"Recently, the Internet-of-Things technique is believed to play an important role as the foundation of the coming Artificial Intelligence age for its capability to sense and collect real-time context information of the world, and the concept Artificial Intelligence of Things (AIoT) is developed to summarize this vision. However, in typical centralized architecture, the increasing of device links and massive data will bring huge congestion to the network, so that the latency brought by unstable and time-consuming long-distance network transmission limits its development. The multi-access edge computing (MEC) technique is now regarded as the key tool to solve this problem. By establishing a MEC-based AIoT service system at the edge of the network, the latency can be reduced with the help of corresponding AIoT services deployed on nearby edge servers. However, as the edge servers are resource-constrained and energy-intensive, we should be more careful in deploying the related AIoT services, especially when they can be composed to make complex applications. In this paper, we modeled complex AIoT applications using directed acyclic graphs (DAGs), and investigated the relationship between the AIoT application performance and the energy cost in the MEC-based service system by translating it into a multi-objective optimization problem, namely the CA $$^3$$ 3 D problem — the optimization problem was efficiently solved with the help of heuristic algorithm. Besides, with the actual simple or complex workflow data set like the Alibaba Cloud and the Montage project, we conducted comprehensive experiments to evaluate the results of our approach. The results showed that the proposed approach can effectively obtain balanced solutions, and the factors that may impact the results were also adequately explored.","['Engineering', 'Communications Engineering, Networks', 'Information Systems and Communication Service', 'Computer Communication Networks', 'Signal,Image and Speech Processing']"
doi:10.1038/s42256-022-00446-y,en,Optimizing quantum annealing schedules with Monte Carlo tree search enhanced with neural networks,"['OriginalPaper', 'Article']","Quantum annealing is a practical approach to approximately implement the adiabatic quantum computational model in a real-world setting. The goal of an adiabatic algorithm is to prepare the ground state of a problem-encoded Hamiltonian at the end of an annealing path. This is typically achieved by driving the dynamical evolution of a quantum system slowly to enforce adiabaticity. Properly optimized annealing schedules often considerably accelerate the computational process. Inspired by the recent success of deep reinforcement learning such as DeepMind’s AlphaZero, we propose a Monte Carlo tree search (MCTS) algorithm and its enhanced version boosted by neural networks—which we name QuantumZero (QZero)—to automate the design of annealing schedules in a hybrid quantum–classical framework. Both the MCTS and QZero algorithms perform remarkably well in discovering effective annealing schedules even when the annealing time is short for the 3-SAT examples considered in this study. Furthermore, the flexibility of neural networks allows us to apply transfer-learning techniques to boost QZero’s performance. We demonstrate in benchmark studies that MCTS and QZero perform more efficiently than other reinforcement learning algorithms in designing annealing schedules. Quantum annealers are computational models implemented on quantum hardware that can efficiently solve combinatorial optimization problems. Annealing schedules with enhanced performance can be discovered with a Monte Carlo tree search algorithm and an enhanced version incorporating value and policy neural networks—as inspired by DeepMind’s AlphaZero.","['Engineering', 'Engineering, general']"
doi:10.1007/s10479-022-04572-z,en,Strategic bidding in freight transport using deep reinforcement learning,"['OriginalPaper', 'Original Research']","This paper presents a multi-agent reinforcement learning algorithm to represent strategic bidding behavior by carriers and shippers in freight transport markets. We investigate whether feasible market equilibriums arise without central control or communication between agents. Observed behavior in such environments serves as a stepping stone towards self-organizing logistics systems like the Physical Internet, while also offering valuable insights for the design of contemporary transport brokerage platforms. We model an agent-based environment in which shipper and carrier actively learn bidding strategies using policy gradient methods, posing bid- and ask prices at the individual container level. Both agents aim to learn the best response given the expected behavior of the opposing agent. Inspired by financial markets, a neutral broker allocates jobs based on bid-ask spreads. Our game-theoretical analysis and numerical experiments focus on behavioral insights. To evaluate system performance, we measure adherence to Nash equilibria, fairness of reward division and utilization of transport capacity. We observe good performance both in predictable, deterministic settings ( $$\sim $$ ∼  95% adherence to Nash equilibria) and highly stochastic environments ( $$\sim $$ ∼  85% adherence). Risk-seeking behavior may increase an agent’s reward share, yet overly aggressive strategies destabilize the system. The results suggest a potential for full automation and decentralization of freight transport markets. These insights ease the design of real-world market platforms, suggesting an innate tendency of markets to reach equilibria without behavioral models, information sharing or explicit incentives.","['Business and Management', 'Operations Research/Decision Theory', 'Combinatorics', 'Theory of Computation']"
