identifier,language,title,genre,abstract,subjects
doi:10.1007/978-3-030-98064-1_3,en,Responsive Regulation of Dynamic UAV Communication Networks Based on Deep Reinforcement Learning,OriginalPaper,"In this chapter, the regulation of an Unmanned Aerial Vehicle (UAV) communication network is investigated in the presence of dynamic changes in the UAV lineup and user distribution. We target an optimal UAV control policy which is capable of identifying the upcoming change in the UAV lineup (quit or join-in) or user distribution, and proactively relocating the UAVs ahead of the change rather than passively dispatching the UAVs after the change. Specifically, a deep reinforcement learning (DRL)-based UAV control framework is developed to maximize the accumulated user satisfaction (US) score for a given time horizon which is able to handle the change in both the UAV lineup and user distribution. The framework accommodates the changed dimension of the state-action space before and after the UAV lineup change by deliberate state transition design. In addition, to handle the continuous state and action space, deep deterministic policy gradient (DDPG) algorithm, which is an actor-critic based DRL method, is exploited. Furthermore, to promote learning exploration around the timing of the change, the original DDPG scheme is adapted into an asynchronous parallel computing (APC) structure which leads to better training performance in both the critic and actor networks. Finally, extensive simulations are conducted to validate the convergence of the proposed learning approach, and demonstrate its capability in jointly handling the dynamics in UAV lineup and user distribution as well as its superiority over a passive reaction method.","['Engineering', 'Communications Engineering, Networks', 'Computational Intelligence', 'Computer Communication Networks', 'Artificial Intelligence']"
doi:10.1007/s00500-021-06531-5,en,Cognitive linear discriminant regression computing technique for HTTP video services in SDN networks,"['OriginalPaper', 'Focus']","In recent times, the service providers and the operators are facing the problems like visual quality degradations and frequent interruptions during video streaming, due to higher dynamism of network conditions. The video parameters like occupancy, playback quality, underflow/overflow buffer, and rate switching frequency/amplitude affect the quality of user’s experience. In the present scenario, numerous adaptive streaming protocols are developed to provide continuous service to the user’s under complex network condition with heterogeneous devices. In this research article, linear discriminant regression technique is proposed based on cognitive computing in order to predict the user’s quality of experience over software-defined network. By varying the network and the objective parameters, initially the mean opinion score is collected from the users. Further, a new architecture is developed on the basis of linear discriminant regression technique that uses the mean opinion score under different network conditions to predict the expected mean opinion score. The simulation results showed that the linear discriminant regression technique achieved better video quality compared to linear regression technique in terms of peak signal-to-noise ratio, structural similarity index, and video quality metric by varying the video resolutions, bit-rates, and frame rates.","['Engineering', 'Computational Intelligence', 'Artificial Intelligence', 'Mathematical Logic and Foundations', 'Control, Robotics, Mechatronics']"
doi:10.1007/978-3-031-19493-1_8,en,Reinforcement Learning with Success Induced Task Prioritization,OriginalPaper,"Many challenging reinforcement learning (RL) problems require designing a distribution of tasks that can be applied to train effective policies. This distribution of tasks can be specified by the curriculum. A curriculum is meant to improve the results of learning and accelerate it. We introduce Success Induced Task Prioritization (SITP), a framework for automatic curriculum learning, where a task sequence is created based on the success rate of each task. In this setting, each task is an algorithmically created environment instance with a unique configuration. The algorithm selects the order of tasks that provide the fastest learning for agents. The probability of selecting any of the tasks for the next stage of learning is determined by evaluating its performance score in previous stages. Experiments were carried out in the Partially Observable Grid Environment for Multiple Agents (POGEMA) and Procgen benchmark. We demonstrate that SITP matches or surpasses the results of other curriculum design methods. Our method can be implemented with handful of minor modifications to any standard RL framework and provides useful prioritization with minimal computational overhead.","['Computer Science', 'Artificial Intelligence']"
doi:10.1007/978-3-030-96772-7_50,en,RepBFL: Reputation Based Blockchain-Enabled Federated Learning Framework for Data Sharing in Internet of Vehicles,OriginalPaper,"Internet of Vehicles (IoV) enables the integration of smart vehicles with Internet and collaborative analysis from shared data among vehicles. Machine learning technologies show significant advantages and efficiency for data analysis in IoV. However, the user data could be sensitive in nature, and the reliability and efficiency of sharing these data is hard to guarantee. Moreover, due to the intermittent and unreliable communications of various distributed vehicles, the traditional machine learning algorithms are not suitable for heterogeneous IoV network. In this paper, we propose a novel reputation mechanism framework that integrates the IoV with blockchain and federated learning named RepBFL. In this framework, blockchain is used to protect the shared data between the vehicles. The Road Side Units (RSU) select the high reputation vehicular nodes to share their data for federated learning. To enhance the security and reliability of the data sharing process, we develop the reputation calculated mechanism to evaluate the reliability of all vehicles in IoV. The proposed framework is feasible for the large heterogeneous vehicular networks and perform the collaborative data analysis in distributed vehicles. The experimental results show that the proposed approach can improve the data sharing efficiency. Furthermore, the reputation mechanism is able to deal with malicious behaviors effectively.","['Computer Science', 'Theory of Computation', 'Computer Communication Networks', 'Computing Milieux', 'Special Purpose and Application-Based Systems', 'Software Engineering/Programming and Operating Systems', 'Artificial Intelligence']"
doi:10.1007/978-3-031-02462-7_32,en,Deep Catan,OriginalPaper,"Catan is a popular multiplayer board game that involves multiple gameplay notions: stochastic elements related to the dice rolls as well as to the initial placement of resources on the map and the drawing of development cards, strategic notions for the placement of the cities and the roads which call upon topological and shape recognition notions and notions of expectation of gains linked to the probabilities of the rolls of the dice. In this paper, we develop a policy for this game using a convolutional neural network. The used deep reinforcement learning algorithm is Expert Iteration [ 2 ] which has already given excellent results for Alpha Zero and its descendants.","['Computer Science', 'Theory of Computation', 'Mathematics of Computing', 'Information Systems and Communication Service', 'Machine Learning']"
doi:10.1007/978-3-031-10186-1_3,en,Motivations for Integrating Edge Intelligence with Blockchain,OriginalPaper,"As shown in Fig. 3.1, the limitations of EI and the complementary advantages of BC are painfully clear. Spontaneously, the appearance of BC-assisted EI would be expected to pave the way for the development of emerging intelligent services. In this chapter, we first discuss the limitations of EI. Then, we elaborate the benefits of BC in EI.","['Engineering', 'Communications Engineering, Networks', 'Cyber-physical systems, IoT', 'Professional Computing']"
doi:10.1007/978-981-19-4546-5_26,en,CATS: A Cache Time-to-Live Setting Auto Adjustment Strategy for an Air Ticket Query Service,OriginalPaper,"A cache is an efficient way to speed up the response of services, which can also be applied in air ticket query services. However, the time-to-live (TTL) setting is a challenging task for the caching mechanism especially when the validity periods of the records change with time, which is the case for the air tickets. In air ticket query services, the validity of air ticket information is verified when a user places the order. It provides a chance to adjust the initial TTLs. In this paper, we provide a CA che T ime-to-live setting auto adjustment S trategy (CATS) for air ticket query service based on the verification results during order placement. In addition, by considering the associations between cached records, CATS can also adjust the TTL settings for related cached records. Experiments are conducted to test and compare different implementations of CATS and the results show that CATS can maintain both the hit rates and verification success rates at a high level.","['Computer Science', 'Computers and Society', 'Information Systems and Communication Service', 'Artificial Intelligence', 'Computer Communication Networks', 'Computer System Implementation', 'Special Purpose and Application-Based Systems']"
doi:10.1007/978-3-031-10983-6_13,en,Improving Parking Occupancy Prediction in Poor Data Conditions Through Customization and Learning to Learn,OriginalPaper,"Parking occupancy prediction (POP) can be used for many real-time parking-related services to significantly reduce the unnecessary cruising for parking and additional congestion. However, accurate and fast forecasting in data-poor car parks remains a challenge. To tackle the bottleneck, this paper proposes a knowledge transfer framework that can customize a lightweight but effective pre-trained network to those data-deficient parking lots for POP. The proposed approach integrates two novel ideas, namely Customization: select source domain utilizing reinforcement learning based on parking-related feature matching; and Learning to Learn: extract insightful prior knowledge from the selected sources using Federated Meta-learning. Results of a real-world case study with 34 parking lots in Guangzhou City, China, from June 1 to 30, 2018, show that compared to the baseline, the proposed approach can 1) bring approximately 21 $$\%$$ % extra performance improvement; 2) improve the model adaptation and convergence speed dramatically; 3) stabilize predictions with error minor variance.","['Computer Science', 'Artificial Intelligence', 'Data Structures and Information Theory', 'Information Systems Applications (incl. Internet)', 'Theory of Computation', 'Computer Appl. in Administrative Data Processing', 'Computer Appl. in Social and Behavioral Sciences']"
doi:10.1007/978-3-030-94763-7_10,en,Task Scheduling and Resource Management in MEC-Enabled Computing Networks,OriginalPaper,"The rapid development of the fifth generation (5G) promotes a variety of new applications, which will pose a huge challenge to the computing resources of networks. Computing networks is a promising technology, which can provide ubiquitous computing resources for applications in 5G. However, resource optimization in computing networks is still an open problem. In this paper, we propose a novel resource allocation framework for computing networks to investigate the energy consumption minimization problem in terms of delay constraint. To tackle the problem, we propose a dynamic task scheduling and resource allocation algorithm to utilizing the Lyapunov optimization method, which doesn’t need to know any prior knowledge of networks. In order to reduce the complexity of solving the problem, we decompose the original problem into several sub-problem to solve. Particulary, the solutions of transmit power and subcarrier assignment are obtained by using the Lagrangian dual decomposition method. The solutions of computation time, postponing time, and CPU-cycle frequency are achieved in the closed form. Simulation results show that the performance of the proposed algorithms and can achieve the tradeoff between the average delay and the average energy consumption.","['Computer Science', 'Special Purpose and Application-Based Systems', 'Computer Communication Networks', 'Computer Applications', 'Computer System Implementation']"
doi:10.1007/978-3-031-16224-4_24,en,Comparison of Reinforcement Learning Based Control Algorithms for One Autonomous Driving Problem,OriginalPaper,"Autonomous driving systems include modules of several levels. Thanks to deep learning architectures at the moment technologies in most of the levels have high accuracy. It is important to notice that currently in autonomous driving systems for many tasks classical methods of supervised learning are no longer applicable. In this paper we are interested in a specific problem, that is to control a car to move along a given reference trajectory using reinforcement learning algorithms. In control theory, this problem is called an optimal control problem for moving along the reference trajectory. Airsim environment is used to simulate a moving car for a fixed period of time without obstacles. The purpose of our research is to determine the best reinforcement learning algorithm for a formulated problem among state-of-the-art algorithms such as DDPG, PPO, SAC, DQN and others. As a result of the conducted training and testing, it was revealed that the best algorithm for this problem is A2C.","['Mathematics', 'Mathematical Applications in Computer Science', 'Data Structures and Information Theory', 'Discrete Mathematics in Computer Science', 'Numerical Analysis', 'Algorithms', 'Artificial Intelligence']"
doi:10.1007/978-3-031-10986-7_44,en,Towards Explainable Reinforcement Learning Using Scoring Mechanism Augmented Agents,OriginalPaper,"Deep reinforcement learning (DRL) is increasingly used in application areas such as medicine and finance. However, the direct mapping from state to action in DRL makes it challenging to explain why decisions are made. Existing algorithms for explaining DRL policy are posteriori, explaining to an agent after it has been trained. As a common limitation, these posteriori methods fail to improve training with the deduced knowledge. Face with that, an end-to-end trainable explanation method is proposed, in which an Adaptive Region Scoring Mechanism (ARS) is embedded into DRL system. The ARS explains the agent’s action by evaluating the features of the input state that are most relevant action before DRL re-learn from task-related regions. The proposed method is validated on Atari games. Experiments demonstrate that agent using the explainable proposed mechanism outperforms the original models.","['Computer Science', 'Artificial Intelligence', 'Computer Imaging, Vision, Pattern Recognition and Graphics', 'Computers and Education', 'Computer Applications']"
doi:10.1007/978-3-031-08011-1_24,en,Hybrid Offline/Online Optimization for Energy Management via Reinforcement Learning,OriginalPaper,"Constrained decision problems in the real world are subject to uncertainty. If predictive information about the stochastic elements is available offline, recent works have shown that it is possible to rely on an (expensive) parameter tuning phase to improve the behavior of a simple online solver so that it roughly matches the solution quality of an anticipative approach but maintains its original efficiency. Here, we start from a state-of-the-art offline/online optimization method that relies on optimality conditions to inject knowledge of a (convex) online approach into an offline solver used for parameter tuning. We then propose to replace the offline step with (Deep) Reinforcement Learning (RL) approaches, which results in a simpler integration scheme with a higher potential for generalization. We introduce two hybrid methods that combine both learning and optimization: the first optimizes all the parameters at once, whereas the second exploits the sequential nature of the online problem via the Markov Decision Process framework. In a case study in energy management, we show the effectiveness of our hybrid approaches, w.r.t. the state-of-the-art and pure RL methods. The combination proves capable of faster convergence and naturally handles constraint satisfaction.","['Computer Science', 'Mathematics of Computing', 'Artificial Intelligence', 'Theory of Computation', 'Information Systems and Communication Service', 'Computer Systems Organization and Communication Networks']"
doi:10.1007/978-3-031-16302-9_5,en,Deep Learning in Audio Classification,OriginalPaper,"Audio processing technology is happening everywhere in our life. We ask our car to make a call for us while driving, or we let Alexa turn off the light for us when we don’t want to get out of bed before sleep. In all of these audio-based applications and research, it is AI and ML that makes the computer or the smart phone understand us via our voice [ 1 ]. As an important part of artificial intelligence (AI), especially machine learning (ML), which has had great influences in many areas of AI and ML-based research and applications. This paper focuses on deep learning structures and applications for audio classification. We conduct a detailed review of literature in audio-based DL and DRL approaches and applications. We also discuss the limitation and possible future works for audio-based DL approach.","['Computer Science', 'Computer Systems Organization and Communication Networks', 'Information Systems and Communication Service', 'Artificial Intelligence', 'Computer Appl. in Social and Behavioral Sciences', 'Computers and Education']"
doi:10.1007/978-3-030-92054-8_5,en,"Artificial Intelligence: Need, Evolution, and Applications for Transportation Systems",OriginalPaper,"Artificial intelligence (AI) is a concept in which entities and systems have the ability to learning and decision-making by imitating biological processes. In this chapter, we first introduce the evolution of AI to give the reader a good grasp of artificial intelligence (AI) and then introduce the existing machine learning (ML) with three typical classifications: unsupervised learning, supervised learning, and reinforcement learning. Supervised learning makes decision based on the output labels provided in training. Unsupervised learning works based on pattern discovery without having the pre-knowledge of output labels. The third machine learning paradigm is reinforcement learning (RL), which takes sequential actions rooted in Markov Decision Process (MDP) with a rewarding or penalizing criterion. Some other kinds of ML algorithms such as federated learning and transfer learning are also introduced in the first subsection. The future transportation network aims to develop a highly dynamic and intelligent system, which enables the networks to change the environment to satisfy various requirements and service types. Cellular-V2X, vehicular edge network, and unmanned aerial vehicle (UAV) are recently attacking network architecture to enable the future transportation. In the second section, we introduce how to integrate AI into cellular-V2X, vehicular edge network, and UAV. Leveraging AI into transportation helps the sector increase passenger safety, reduce traffic congestion and accidents, lessen carbon emissions, and also minimize the overall financial expenses. Finally, we review some existing research that uses AI to enable autonomous driving, traffic control and prediction, and path planning.","['Engineering', 'Cyber-physical systems, IoT', 'Communications Engineering, Networks', 'Automotive Engineering']"
doi:10.1007/978-3-031-02056-8_18,en,Multi-objective Genetic Programming for Explainable Reinforcement Learning,OriginalPaper,"Deep reinforcement learning has met noticeable successes recently for a wide range of control problems. However, this is typically based on thousands of weights and non-linearities, making solutions complex, not easily reproducible, uninterpretable and heavy. The present paper presents genetic programming approaches for building symbolic controllers. Results are competitive, in particular in the case of delayed rewards, and the solutions are lighter by orders of magnitude and much more understandable.","['Computer Science', 'Professional Computing', 'Algorithm Analysis and Problem Complexity', 'Computer Systems Organization and Communication Networks', 'Software Engineering/Programming and Operating Systems', 'Artificial Intelligence']"
doi:10.1007/978-981-19-4831-2_24,en,Implementing Reinforcement Learning to Design a Game Bot,OriginalPaper,"Artificial intelligence is the technology of the future, it has accomplished tasks that were assumed to be impossible earlier. It has very promising future aspects. It has proven to be useful in almost every field. Training an artificial intelligence model requires a lot of data. 90% of world’s total data has been generated over last two years only. Sometimes it is not feasible to have such huge amounts of data to train models. Here, comes in the situation “reinforcement learning” where the agent learns from the environment. Reinforcement learning has been applied to various fields like manufacturing, inventory management, delivery management, power systems, finance sectors and self-driving cars. Using the same procedure an artificial agent can be trained to perform desirable tasks. In this paper we discuss the implementation of reinforcement learning to develop a bot that plays a game just like humans.","['Computer Science', 'Artificial Intelligence', 'Computational Intelligence', 'Computer Applications', 'Machine Learning']"
doi:10.1007/978-3-030-95405-5_24,en,PS-QMix: A Parallel Learning Framework for Q-Mix Using Parameter Server,OriginalPaper,"With the development of deep reinforcement learning and multi-agent modeling, Multi-Agent Reinforcement Learning (MARL) has become a very active research topic recently. Q-Mix is a popular algorithm for solving MARL tasks where the individual agents are allowed to be trained in a centralized manner. As the scale and complexity of MARL tasks grow, there is an urging requirement for a more efficient training strategy. As a consequence, it is demanding to develop a Q-Mix training algorithm which can benefit from parallel computation. However, how classic distributed machine learning frameworks work with Q-Mix is a less studied problem. In this paper, we propose the PS-Qmix algorithm to apply the Parameter Server framework to training QMix agents in parallel. Our algorithm employs multiple distributed worker threads for data generation and model learning, where these two processes are decoupled and executed in alternation. To cater for different simulation speed of the environment, the proposed algorithm allows the user to tune the relative proportion of computation allocated to data generation and model learning. We evaluate the PS-Qmix algorithm on a StarCraft II micro-combat task. As we increase the number of worker threads, we observe significant speed-up in both data generation and model learning. The evaluation results indicate that our method is effective in utilizing distributed computation resources to train Q-Mix agents.","['Computer Science', 'Artificial Intelligence', 'Computer Imaging, Vision, Pattern Recognition and Graphics', 'Information Systems and Communication Service', 'Computer Systems Organization and Communication Networks', 'Computer Appl. in Social and Behavioral Sciences']"
doi:10.1007/978-981-19-2259-6_101,en,A Scalable Multi-agent Reinforcement Learning Approach for the Dynamic Taxi Dispatch Problem,OriginalPaper,"In this work we approach the dynamic taxi dispatch problem as a Markov Game and solve it using a model free Deep Reinforcement Learning approach. We propose a novel Markov Game formulation, and we address the challenges associated with such formulation and strive to improve the efficiency of the solution. The biggest challenge is the size of the state space which grows exponentially with the size of the taxi fleet, the number of passengers, and the number of locations. We tackle this problem by representing the problem state as an image and using a Convolutional Neural Network as a function approximator, making the state space dependent only on the size of the map. The proposed algorithm was validated against a rule-based heuristic under different supply-demand ratios, and it was found to outperform the rule-based technique by a large margin when there is a lack of supply.","['Engineering', 'Control, Robotics, Mechatronics', 'Transportation Technology and Traffic Engineering']"
