identifier,language,title,genre,abstract,subjects
doi:10.1038/s41598-022-21125-3,en,Adaptability and sustainability of machine learning approaches to traffic signal control,"['OriginalPaper', 'Article']","This study investigates how adaptable Machine Learning Traffic Signal control methods are to topological variability. We ask how well can these methods generalize to non-Manhattan-like networks with non-uniform distances between intersections. A Machine Learning method that is highly reliable in various topologies is proposed and compared with state-of-the-art alternatives. Lastly, we analyze the sustainability of different traffic signal control methods based on computational efforts required to achieve convergence and perform training and testing. We show that our method achieves an approximately seven-fold improvement in terms of CO $$_2$$ 2 emitted in training over the second-best method.","['Science, Humanities and Social Sciences, multidisciplinary', 'Science, Humanities and Social Sciences, multidisciplinary', 'Science, multidisciplinary']"
doi:10.1007/s00170-022-09877-8,en,Deep reinforcement learning applied to an assembly sequence planning problem with user preferences,"['OriginalPaper', 'ORIGINAL ARTICLE']","Deep reinforcement learning (DRL) has demonstrated its potential in solving complex manufacturing decision-making problems, especially in a context where the system learns over time with actual operation in the absence of training data. One interesting and challenging application for such methods is the assembly sequence planning (ASP) problem. In this paper, we propose an approach to the implementation of DRL methods in ASP. The proposed approach introduces in the RL environment parametric actions to improve training time and sample efficiency and uses two different reward signals: (1) user’s preferences and (2) total assembly time duration. The user’s preferences signal addresses the difficulties and non-ergonomic properties of the assembly faced by the human and the total assembly time signal enforces the optimization of the assembly. Three of the most powerful deep RL methods were studied, Advantage Actor-Critic (A2C), Deep Q-Learning (DQN), and Rainbow, in two different scenarios: a stochastic and a deterministic one. Finally, the performance of the DRL algorithms was compared to tabular Q-Learnings performance. After 10,000 episodes, the system achieved near optimal behaviour for the algorithms tabular Q-Learning, A2C, and Rainbow. Though, for more complex scenarios, the algorithm tabular Q-Learning is expected to underperform in comparison to the other 2 algorithms. The results support the potential for the application of deep reinforcement learning in assembly sequence planning problems with human interaction.","['Engineering', 'Industrial and Production Engineering', 'Media Management', 'Mechanical Engineering', 'Computer-Aided Engineering (CAD, CAE) and Design']"
doi:10.1007/s40747-022-00735-4,en,Research on energy saving technology at mobile edge networks of IoTs based on big data analysis,"['OriginalPaper', 'Original Article']","The 5G IoT is very complicated and there are many factors that affect the network performance. Presently, the optimization of network is still the focus of research. Although the existing literature has done a large number of researches in this aspect, there have always been problems, such as complex algorithms. Based on the previous research, we propose a big data mining analysis method, which improves the comprehensive performance of the network by analyzing the relationship of massive data variables so as to optimize the combination of the network. In this paper, according to each of terminal variables at any moment such as power consumption, bandwidth, noise power, subcarrier bandwidth, interference power and coding efficiency, etc. we develop the mathematical modeling of principal component multiple regression. Then we simulate this scheme by edge computing technology and combine it with intelligent algorithms. The research results show that this method can effectively predict the data concerned, and the residual is the smallest. Therefore, the research provides an important basic for application of the approach to the mobile edge network optimization of IoTs.","['Engineering', 'Computational Intelligence', 'Complexity', 'Data Structures and Information Theory']"
doi:10.1007/s10462-022-10138-z,en,Design possibilities and challenges of DNN models: a review on the perspective of end devices,OriginalPaper,"Deep Neural Network (DNN) models for both resource-rich environments and resource-constrained devices have become abundant in recent years. As of now, the literature on different available options for the design, development, and deployment of DNN models to resource constrained-end devices is limited and demands extensive further study. This paper reviews vital research efforts for the design of DNN models while deploying them at the end devices such as smart cameras for real-time object detection tasks. The design ideas include the types of DNN models, hardware and software requirements for the development, resource constraints imposed by the computing devices, and the optimization techniques required for the efficient processing of DNN. The study also aims to conduct a systematic literature review on current trends in different real-time applications of DNN models and explores the following four dimensions: (1) DNN model perspective: to associate appropriate DNN models with the proper hardware to achieve optimal throughput. (2) Hardware perspective: to answer different available options in hardware platforms for achieving on-device intelligence. (3) Resources and optimization perspective: to analyze the type of resource limitations in hardware platforms and the use of optimization techniques to overcome the performance issues. (4) Application perspective: to understand the real-time uses of DNN models in different application domains. This work also explores different performance measures that need to be considered for on-device intelligence and provides possible future directions for the challenges reviewed.","['Computer Science', 'Artificial Intelligence', 'Computer Science, general']"
doi:10.1007/s11063-022-10796-8,en,Improving Target-driven Visual Navigation with Attention on 3D Spatial Relationships,OriginalPaper,"Embodied Artificial Intelligence has become popular in recent years. Its task shifts from focusing on internet images to active settings, involving an embodied agent to perceive and act within 3D environments. In this paper, we study the Target-driven Visual Navigation (TDVN) in 3D indoor scenes using deep reinforcement learning techniques. The generalization of TDVN is a long-standing ill-posed issue, where the agent is expected to transfer intelligent knowledge from training domains to unseen domains. To address this issue, we propose a model that combines visual and relational graph features to learn the navigation policy. Graph convolutional networks are used to obtain graph features, which encodes spatial relations between objects. We also adopt a Target Skill Extension module to generate sub-targets, in order to allow the agent to learn from its failures. For evaluation, we perform experiments in the AI2-THOR. Experimental results show that our proposed model outperforms baselines under various metrics.","['Computer Science', 'Artificial Intelligence', 'Complex Systems', 'Computational Intelligence']"
doi:10.1007/s10586-022-03573-8,en,Intelligent energy aware approaches for residential buildings: state-of-the-art review and future directions,OriginalPaper,"In the past decade, the world’s energy consumption is increasing largely, while residential buildings are the primary sector consuming about a quarter of the total energy produced. The researchers have made significant efforts to reduce energy usage in previous years by implementing energy monitoring and prediction techniques. Further, these techniques have been utilized for energy optimization in residential buildings and provide the consumer awareness about the usage patterns. In this paper, intelligent energy aware approaches have been reviewed by focusing on energy monitoring, prediction, optimization and performance evaluation using benchmark energy datasets. This review has been concluded with a discussion on future research directions for improving energy aware approaches in residential buildings.","['Computer Science', 'Processor Architectures', 'Operating Systems', 'Computer Communication Networks']"
doi:10.1007/s00521-022-07803-3,en,Deep reinforcement learning for automated search of model parameters: photo-fenton wastewater disinfection case study,"['OriginalPaper', 'Original Article']","Numerical optimization solves problems that are analytically intractable at the cost of arriving at a sufficiently good but rarely optimal solution. To maximize the result, optimization algorithms are run with the guidance and supervision of a human, usually an expert in the problem. Recent advances in deep reinforcement learning motivate interest in an artificial agent capable of learning to do the expert’s task. Specifically, we present a proximal policy optimization agent that learns to optimize in a real case study such as the modeling of the photo-fenton disinfection process, which involves a number of parameters that have to be adjusted to minimize the error of the model with respect to the experimental data collected in several trials. The expert spends an average of 4 h to find a suitable set of parameters. On the other hand, the agent we present does not require a human expert to guide or validate the optimization procedure and achieves similar results in $$2.5\times$$ 2.5 × less time.","['Computer Science', 'Artificial Intelligence', 'Data Mining and Knowledge Discovery', 'Probability and Statistics in Computer Science', 'Computational Science and Engineering', 'Image Processing and Computer Vision', 'Computational Biology/Bioinformatics']"
doi:10.1186/s12859-022-04912-7,en,A reinforcement learning approach for protein–ligand binding pose prediction,"['OriginalPaper', 'Research']","Protein ligand docking is an indispensable tool for computational prediction of protein functions and screening drug candidates. Despite significant progress over the past two decades, it is still a challenging problem, characterized by the still limited understanding of the energetics between proteins and ligands, and the vast conformational space that has to be searched to find a satisfactory solution. In this project, we developed a novel reinforcement learning (RL) approach, the asynchronous advantage actor-critic model (A3C), to address the protein ligand docking problem. The overall framework consists of two models. During the search process, the agent takes an action selected by the actor model based on the current location. The critic model then evaluates this action and predict the distance between the current location and true binding site. Experimental results showed that in both single- and multi-atom cases, our model improves binding site prediction substantially compared to a naïve model. For the single-atom ligand, copper ion (Cu 2+ ), the model predicted binding sites have a median root-mean-square-deviation (RMSD) of 2.39 Å to the true binding sites when starting from random starting locations. For the multi-atom ligand, sulfate ion (SO 4 2− ), the predicted binding sites have a median RMSD of 3.82 Å to the true binding sites. The ligand-specific models built in this study can be used in solvent mapping studies and the RL framework can be readily scaled up to larger and more diverse sets of ligands.","['Life Sciences', 'Bioinformatics', 'Microarrays', 'Computational Biology/Bioinformatics', 'Computer Appl. in Life Sciences', 'Algorithms']"
doi:10.1007/s13042-022-01641-4,en,Modular transfer learning with transition mismatch compensation for excessive disturbance rejection,"['OriginalPaper', 'Original Article']","Underwater robots in shallow waters usually suffer from strong wave forces, which may frequently exceed robot’s control constraints. Learning-based controllers are suitable for disturbance rejection control, but the excessive disturbances heavily affect the state transition in Markov Decision Process (MDP) or Partially Observable Markov Decision Process (POMDP). This issue is amplified by training-test model mismatch. In this paper, we propose a transfer reinforcement learning algorithm using Transition Mismatch Compensation (TMC), that learns an additional compensatory policy through minimizing mismatch of transitions predicted by the two dynamics models of the source and target tasks. A modular network of learning policies is applied, composed of a Generalized Control Policy (GCP) and an Online Disturbance Identification Model (ODI). GCP is first trained over a wide array of disturbance waveforms. ODI then learns to use past states and actions of the system to predict the disturbance waveforms which are provided as input to GCP (along with the system state). We demonstrated on a pose regulation task in simulation that TMC is able to successfully reject the disturbances and stabilize the robot under an empirical model of the robot system, meanwhile improve sample efficiency.","['Engineering', 'Computational Intelligence', 'Artificial Intelligence', 'Control, Robotics, Mechatronics', 'Complex Systems', 'Systems Biology', 'Pattern Recognition']"
doi:10.1007/s00521-022-07065-z,en,Learning from data streams for automation and orchestration of 6G industrial IoT: toward a semantic communication framework,"['OriginalPaper', 'S.I.: LSNC & OUA']","Established methods of communication are based mainly on Shannon’s theory of information, which purposefully overlooks semantic elements of communication. The future wireless technology should promise to facilitate many services, based on content, needs, and semantics, precisely customized to network capabilities. This gave rise to significant concern for Semantic Communication (SC), a novel paradigm considering the message’s meaning during transmission. Federated learning (FL) and Asynchronous Advantage Actor Critic (A3C) are the two emerging distributed and artificially intelligent approaches that provide diverse and possibly massive network coverage for data-driven SC solutions of industry 4.0 automation. Although SC is still in an early development stage, FL-empowered architecture has been recognized as one of the most promising solutions to meet the ubiquitous intelligence in the anticipated sixth-generation (6G) networks. This paper identifies industry 4.0 automation needs that drive the convergence of artificial intelligence and 6G for learning from data streams. We develop a novel SC framework based on the FL and A3C networks and discuss its potential along with transfer learning to address most of the new difficulties anticipated in 6G for industrial communication networks. Our proposed framework has been evaluated with extensive simulation results.","['Computer Science', 'Artificial Intelligence', 'Data Mining and Knowledge Discovery', 'Probability and Statistics in Computer Science', 'Computational Science and Engineering', 'Image Processing and Computer Vision', 'Computational Biology/Bioinformatics']"
doi:10.1007/s10489-021-03084-w,en,Reinforcement learning based connectivity restoration in wireless sensor networks,OriginalPaper,"Connectivity is a critical prerequisite for the effective operation of data gathering and forwarding procedures in Wireless Sensor Networks (WSNs). Failure of several sensor nodes in the network makes the base station incapable of receiving data from all the portions of the target area. Multiple partitions that are unable to communicate with one another are formed. Such networks are repaired using additional mobile relays. These relays cooperatively work together to create links among the partitions. In order to complete their task, they require a quick, communication-efficient, and machine learning-based approach. Reinforcement learning has evolved as a very efficient approach with long-term solutions in solving such problems. In this work, we propose a Reinforcement Learning-based Connectivity Restoration (RLCR) method that applies an intelligent machine learning algorithm for collaborative movement and connection establishment among partitions using relay nodes. It takes into account the actions of other agents and is capable of learning complicated multi-agent coordinating strategies. In a subsequent step, relay selection and connectivity maintenance have also been included. In RLCR, relays search for isolated partitions while maintaining communication with one another. Besides, we use Python to simulate the procedure and compare the results to various current methodologies. The experimental analysis illustrates that the proposed RLCR method performs better than the standard algorithms.","['Computer Science', 'Artificial Intelligence', 'Mechanical Engineering', 'Manufacturing, Machines, Tools, Processes']"
doi:10.1007/s11227-022-04478-4,en,Enhancing gas detection-based swarming through deep reinforcement learning,OriginalPaper,"Swarm-Intelligence (SI), the collective behavior of decentralized and self-organized system, is used to efficiently carry out practical missions in various environments. To guarantee the performance of swarm, it is highly important that each object operates as an individual system while the devices are organized as simple as possible. This paper proposes an efficient, scalable, and practical swarming system using gas detection device. Each object of the proposed system has multiple sensors and detects gas in real time. To let the objects move toward gas rich spot, we propose two approaches for system design, vector-sum based, and Reinforcement Learning (RL) based. We firstly introduce our deterministic vector-sum-based approach and address the RL-based approach to extend the applicability and flexibility of the system. Through system performance evaluation, we validated that each object with a simple device configuration performs its mission perfectly in various environments.","['Computer Science', 'Programming Languages, Compilers, Interpreters', 'Processor Architectures', 'Computer Science, general']"
doi:10.1007/s13042-022-01549-z,en,A sequential attention interface with a dense reward function for mitosis detection,"['OriginalPaper', 'Original Article']","The work aims to develop a fast detection method for instances of mitosis in breast cell sections, which needs time-consuming and labor-intensive searches. The system consists of two sequential processes. The first involves data pre-processing to avoid confusing images transferring to the successive detection procedure from wasteful computations. The input data is filtered using the blue ratio threshold to remove unnecessary background information and increase the color difference between the target and the non-target. Cropped images of suspicious candidates are classified as mitotic or non-mitotic employing a hard attention model, which only grapes the fine trained features locally and detailly instead of the entire picture. There is less computational complexity in terms of efficiency and performance because there are fewer parameters and smaller image sizes, so the proposed classification system outperforms traditional models, such as LEnet-5 and VGG-19, for the benchmarked data set provided in the TPAC2016 competition data sets. The proposed method is also compared to other methods listed on a ranking table for the ICPR2012 competition using its official test data set.","['Engineering', 'Computational Intelligence', 'Artificial Intelligence', 'Control, Robotics, Mechatronics', 'Complex Systems', 'Systems Biology', 'Pattern Recognition']"
doi:10.1007/s00521-021-06738-5,en,Pipeline risk big data intelligent decision-making system based on machine learning and situation awareness,"['OriginalPaper', 'S.I: LSNC & OUAI']","Underground pipelines are an indispensable part of urban public facilities. However, the frequent occurrence of pipeline accidents in recent years has not only brought great inconvenience to people’s lives, but also affected people’s lives and property safety to a certain extent. Therefore, timely treatment and treatment are very important. Preventing sudden underground pipeline accidents plays an important role in improving urban livability. This article studies pipeline risk big data intelligent decision-making systems based on machine learning and situational awareness. In this paper, by analyzing the application scope of gas leakage and diffusion models under different modes, leakage, diffusion, fire and explosion models are determined, and a combined model framework of leakage accident consequence system analysis is formed. The system uses the pipeline failure probability model and the pipeline failure consequence analysis model to determine the pipeline failure probability, the probability and the consequences of each accident; it uses the spatial analysis ability of GIS technology to determine the accident impact area and displays the impact area in graphics form. Through the effect verification of the test set, the prediction result of the SVR model based on the grid search parameter, the relative percentage error of the predicted value of each sample and the true value fluctuate is in the range of 4%-36%, and the amplitude is not very large. Most of the error values are approximately 13.56% of the MAPE value. The results show that the optimization method using grid search parameters can have better prediction performances.","['Computer Science', 'Artificial Intelligence', 'Data Mining and Knowledge Discovery', 'Probability and Statistics in Computer Science', 'Computational Science and Engineering', 'Image Processing and Computer Vision', 'Computational Biology/Bioinformatics']"
doi:10.1007/s11227-022-04493-5,en,Resource management and switch migration in SDN-based multi-access edge computing environments,OriginalPaper,"As the growing of data volumes due to the successive development of new mobile devices and the creation of new applications, the emergence of multi-access edge computing can successfully improve quality of service based on reduced latency and lower system energy consumption. The introduction of software-defined networking technologies in multi-access edge computing environments supports access to more network devices and enhances the scalability and service management flexibility of mobile edge computing environments. The limited nature of computing resources in mobile edge computing environments makes resource management a critical issue. Therefore, to minimize the energy consumption and latency of task execution in mobile edge computing environment, and to ensure reasonable resource allocation during task execution, a resource management strategy based on multi-objective optimization in edge computing environment is proposed. In this strategy, the overall energy consumption weighting and minimization problem is solved by optimizing the management of communication and computing resources, and an improved NSGA-II algorithm is proposed to rationally allocate communication and computational resources for each task. To deal with load imbalance caused by large traffic fluctuations in multi-access edge computing environments based on software-defined networks, in this paper, a load-balancing-oriented switch migration strategy is proposed in which a switch migration algorithm based on an improved ant colony algorithm is proposed to optimally select the switch migration process so that the static deployment of the controller adapts to the changing needs of dynamic flows in the network. Experimental results demonstrate that the proposed resource management strategy minimizes the latency and energy consumption during task execution and increases resource utilization and average throughput of servers. The proposed switch migration strategy can effectively achieve load balancing and reduce the response time.","['Computer Science', 'Programming Languages, Compilers, Interpreters', 'Processor Architectures', 'Computer Science, general']"
doi:10.1007/s12124-020-09531-6,en,There Can Be no Other Reason for this Behavior: Issues in the Ascription of Knowledge to Humans and AI,"['OriginalPaper', 'Regular Article']","While machine learning techniques have been used to model categorization/decision making tasks that are beyond the capabilities of traditional AI, these new models are typically uninterpretable, i.e., the reasons for their decisions are not clear. Some have argued that, in developing machines that can report the reasons for their decisions, developers should take, as a guide, human explanations for behavior, which make reference to mental states (e.g., knowledge/belief). This proposal is correct, but unattainable given certain characteristics of current AI. To explain, this article draws on recent discourse-analytic research showing that ascriptions of knowledge/belief presume behavioral performances to instantiate particular sorts of broader dispositions. This is reflected by the possibility of ascribing knowledge/belief to an agent on the basis that there can be no other explanation for their observed behavior . The behavior of AI trained through machine learning is unpredictable in ways that precludes such certainty. Consequently, while it is certainly possible to program machines to report mental states of knowledge/belief to account for their decisions, the failure of current AI to engage in typically human forms of life means that such ascribed mental states are inevitably meaningless.","['Psychology', 'Psychology, general', 'Sociology, general', 'Anthropology']"
